type,exclude,date,date_end,what,what_translation,institution,department,where,additional_info,additional_info2,url,slides,video,short_cv,order,academic,professional_2_page,website,one_column_paged,brief_no_pubs,humanities,humanities_description
education,NA,2019-01-29,2022-05-23,"B.A. in Economics, Minor in Data Analytics",NA,NA,NA,"School of Business, SUNY Geneseo",NA,NA,NA,NA,NA,y,NA,NA,NA,NA,NA,NA,NA,NA
prof-act,NA,2022-01-28,present,Participating in a directed study for my data analytics minor,NA,SUNY Geneseo,Data Analytics,"School of Business, SUNY Geneseo",Worked on the study with assistance from Professor Kirk Anne of RIT ,The focus of the study is to determine which combine measurements and college stats/awards are the best indicators a player's worth in the NFL draft,NA,NA,NA,y,NA,NA,NA,NA,NA,NA,NA,NA
work,NA,2020-02-01,2021-08-22,Solar Consultant Intern/Canvasser,NA,Long Island Power Solutions,NA,"Ronkonkoma, NY",Initial door to door homeowner engagement offering free solar estimates,"Advanced to office, calculating, analyzing, and creating customer saving plans based on their energy usage",NA,NA,NA,NA,NA,NA,y,NA,NA,y,NA,NA
work,NA,2017-08-01,2018-12-15,Event Manager,NA,The Bench Bar and Grill,NA,"Stony Brook, NY","Negotiated, booked and organized the setup of large scale events, where profits exceeded expectations by 15% YOY.",NA,NA,NA,NA,NA,NA,NA,NA,NA,NA,NA,NA,NA
technical,NA,NA,NA,"Programming, data analysis and visualisation",NA,NA,NA,NA,"in R (tidyverse), Python and SQL","dplyr, ggplot2, shiny, machine learning, supervised and unsupervised clustering",NA,NA,NA,y,NA,NA,NA,NA,NA,NA,NA,NA
technical,NA,NA,NA,Reproducible research,NA,NA,NA,NA,with R Markdown  + LaTeX + HTML,NA,NA,NA,NA,y,NA,NA,NA,NA,NA,NA,NA,NA
technical,NA,NA,NA,Web development,NA,NA,NA,NA,"(HTML, CSS, JavaScript, GitHub Pages)",NA,NA,NA,NA,y,NA,NA,NA,NA,NA,NA,NA,NA
volunteering,NA,2015-01-01,2018-06-01,Room 4 Love,NA,NA,NA,"Setauket, NY",I helped fundraise and renovate rooms for children battling cancer,NA,NA,NA,NA,NA,2,NA,y,NA,NA,NA,NA,NA
volunteering,NA,2019-09-01,present,Sigma Tau Psi Fraternity,NA,NA,NA,SUNY Geneseo,"Took on multiple roles as Vice President, Secretary and Sergeant at Arms",NA,NA,NA,NA,NA,1,NA,y,NA,NA,NA,NA,NA