type,exclude,date,date_end,what,what_translation,institution,department,where,additional_info,additional_info2,url,slides,video,short_cv,order,academic,professional_2_page,website,one_column_paged,brief_no_pubs,humanities,humanities_description
education,NA,2019-01-29,2022-05-23,"B.A. in Economics, Minor in Data Analytics",NA,NA,NA,SUNY Geneseo,NA,NA,NA,NA,NA,y,NA,NA,NA,NA,NA,NA,NA,NA
prof-act,NA,2022-01-28,2022-05-25,Directed Study,NA,SUNY Geneseo,Data Analytics,SUNY Geneseo,Conducted in-depth analysis of 20 years of NFL draft data to evaluate player success and career longevity. Utilized R and Python to create data visualizations and perform lasso linear regressions for presentation in PowerPoint.,The focus of the study is to determine which combine measurements and college stats/awards are the best indicators a player's worth in the NFL draft,NA,NA,NA,y,NA,NA,NA,NA,NA,NA,NA,NA
work,NA,2020-02-01,2021-08-22,Solar Consultant Intern/Canvasser,NA,Long Island Power Solutions,NA,"Ronkonkoma, NY","Engaged homeowners door-to-door to offer free solar estimates, improving initial customer engagement. Advanced to an office role, where I calculated, analyzed, and developed customer saving plans based on energy usage data.","Advanced to office, calculating, analyzing, and creating customer saving plans based on their energy usage",NA,NA,NA,NA,NA,NA,y,NA,NA,y,NA,NA
work,NA,2017-08-01,2018-12-15,Store Manager,NA,DJ's Clam Shack,NA,"Stony Brook, NY","Managed inventory, ordered supplies, and restocked items to ensure smooth business operations. Oversaw sales transactions totaling over $5,000 per shift, maintaining accurate financial records. Directed and motivated staff to achieve high levels of customer satisfaction and operational efficiency.",NA,NA,NA,NA,NA,NA,NA,NA,NA,NA,NA,NA,NA
technical,NA,NA,NA,"Programming, data analysis and visualisation",NA,NA,NA,NA,"in R (tidyverse), Python and SQL","dplyr, ggplot2, shiny, machine learning, supervised and unsupervised clustering",NA,NA,NA,y,NA,NA,NA,NA,NA,NA,NA,NA
technical,NA,NA,NA,Reproducible research,NA,NA,NA,NA,with R Markdown + LaTeX + HTML,NA,NA,NA,NA,y,NA,NA,NA,NA,NA,NA,NA,NA
technical,NA,NA,NA,Web development,NA,NA,NA,NA,"(HTML, CSS, JavaScript, GitHub Pages)",NA,NA,NA,NA,y,NA,NA,NA,NA,NA,NA,NA,NA
volunteering,NA,2019-09-01,2022-05-25,Sigma Tau Psi Fraternity,NA,NA,NA,SUNY Geneseo,"Took on multiple roles as Vice President, Secretary and Sergeant at Arms",NA,NA,NA,NA,NA,1,NA,y,NA,NA,NA,NA,NA
work,NA,2023-01-09,2024-03-23,Project Manager/Implementation Specialist,NA,Epic Systems,Claims and Remittance,"Verona, WI","Managed the implementation of Epic Claims and Remittance software for high-profile clients, including Memorial Sloan Kettering Cancer Center (MSKCC), Florida Health Care Plans (FHCP), Central Ohio Primary Care (COPC), and St. Barnabas Hospital (SBH Health). Partnered with C-Suite Revenue Cycle Executives to optimize accounts receivable, payment posting, and reporting workflows, achieving a 20% reduction in claim denials and claim edit days. Led the planning and execution of 100+ end-to-end test scripts, ensuring system integrity and compliance while delivering projects on time and within budget. Spearheaded the transition of legacy end-user roles to new Epic roles, ensuring employees received appropriate training and system access prior to go-live.",NA,NA,NA,NA,NA,NA,NA,NA,NA,NA,NA,NA,NA